news_url,image_url,title,text,source_name,date,topics,sentiment,type,tickers
https://investorplace.com/2024/01/3-top-rated-sp-500-stocks-wall-street-analysts-are-loving-now-january-2024/,https://cdn.snapi.dev/images/v1/s/a/h/stores-grocery18-2231731.jpg,3 Top-Rated S&P 500 Stocks Wall Street Analysts Are Loving Now: January 2024,"Although markets have gotten off to a difficult start, Wall Street analysts continue to love and recommend several stocks to investors. Some of these highly praised stocks are mega-cap technology concerns and companies associated with artificial intelligence (AI).",InvestorPlace,"Tue, 16 Jan 2024 18:42:36 -0500",[],Positive,Article,"['COST', 'JPM', 'MSFT']"
https://seekingalpha.com/article/4662784-3-reasons-to-consider-selling-covered-calls-on-jpmorgan-chase,https://cdn.snapi.dev/images/v1/n/4/e/bank31-2231679.jpg,3 Reasons To Consider Selling Covered Calls On JPMorgan Chase,"There are big risks for JPMorgan, especially if the past examples of yield curve inversion come to pass even remotely. A return to the 200-day moving average is the best-case scenario for JPMorgan Chase. Investors may consider longer-dated covered calls to create some defense while matching best case upside for the stock.",Seeking Alpha,"Tue, 16 Jan 2024 18:00:00 -0500",['paylimitwall'],Negative,Article,['JPM']
https://www.businesswire.com/news/home/20240116602140/en/JPMorgan-Chase-Elects-Mark-Weinberger-to-its-Board-of-Directors/,https://cdn.snapi.dev/images/v1/1/y/press17-2231638.jpg,JPMorgan Chase Elects Mark Weinberger to its Board of Directors,"NEW YORK--(BUSINESS WIRE)--JPMorgan Chase (NYSE: JPM) announced today that Mark Weinberger, 62, has been elected to its Board of Directors, effective immediately. He will also serve as a member of the Board's Audit Committee. Mr. Weinberger was Global Chairman and Chief Executive Officer of Ernst & Young (EY) from 2013 to 2019. During his tenure, he led the global professional services organization through a purpose-driven transformation across more than 150 countries to deliver on EY's mis.",Business Wire,"Tue, 16 Jan 2024 17:15:00 -0500",['PressRelease'],Neutral,Article,['JPM']
https://www.proactiveinvestors.com/companies/news/1038552?SNAPI,https://cdn.snapi.dev/images/v1/v/e/w/asset-management42-2231327.jpg,US banks show improved earnings visibility in 4Q,"US bank earnings, with more than $1 trillion in market capital reported on the first day of the fourth quarter earnings season alone, support the view of Bank of America analysts for a continued re-rating higher of bank stocks. In a note to clients following the release of the latest financial reports from JPMorgan Chase & Co (NYSE:JPM), Citigroup Inc (NYSE:C), Wells Fargo & Company (NYSE:WFC) and Bank of New York Mellon Corp (NYSE:BK, ETR:BN9) on Friday, the analysts noted that their view was supported by improving earnings per share (EPS) visibility and the US economy avoiding a hard landing.",Proactive Investors,"Tue, 16 Jan 2024 15:13:51 -0500",['earnings'],Positive,Article,"['C', 'BK', 'JPM', 'WFC']"
https://www.investopedia.com/jpmorgan-settles-sec-charges-its-contracts-violated-whistleblower-law-8426746,https://cdn.snapi.dev/images/v1/w/a/l/bank41-2231078.jpg,JPMorgan Settles SEC Charges Its Contracts Violated Whistleblower Law,JPMorgan Chase (JPM) settled charges with the Securities and Exchange Commission (SEC) Tuesday over allegations it impeded hundreds of advisory clients and brokerage customers from reporting potential violations of securities law.,Investopedia,"Tue, 16 Jan 2024 12:25:39 -0500",[],Negative,Article,['JPM']
https://www.prnewswire.com/news-releases/jp-morgan-releases-2024-alternatives-outlook-navigating-a-shifting-investment-landscape-302036012.html,https://cdn.snapi.dev/images/v1/6/g/press11-2231021.jpg,J.P. Morgan Releases 2024 Alternatives Outlook: Navigating a Shifting Investment Landscape,"Research explores opportunities in Multi-Alternatives Strategies, Core Private Infrastructure, Private Equity and Commercial Real Estate NEW YORK , Jan. 16, 2024 /PRNewswire/ -- J.P. Morgan today released its 2024 outlook for the alternative investment landscape.",PRNewsWire,"Tue, 16 Jan 2024 11:42:00 -0500",['PressRelease'],Neutral,Article,['JPM']
https://www.reuters.com/markets/rates-bonds/three-big-six-us-banks-tap-bond-market-post-earnings-2024-01-16/,https://cdn.snapi.dev/images/v1/l/i/3/bank24-2230939.jpg,Three of 'Big Six' U.S. banks tap bond market post-earnings,"Three of the six largest U.S. banks announced new bond issues on Tuesday, kicking off an expected heavy week for new bank debt.",Reuters,"Tue, 16 Jan 2024 11:12:02 -0500",['earnings'],Positive,Article,"['BAC', 'C', 'GS', 'JPM', 'MS', 'WFC']"
https://www.reuters.com/business/finance/jpmorgans-dimon-top-bankers-meet-chinas-li-ukraines-zelenskiy-davos-2024-01-16/,https://cdn.snapi.dev/images/v1/7/s/9/bank30-2231003.jpg,"JPMorgan's Dimon, top bankers meet China's Li, Ukraine's Zelenskiy in Davos","JPMorgan CEO Jamie Dimon, Bank of America CEO Brian Moynihan, Standard Chartered CEO Bill Winters and Blackstone CEO Steve Schwarzman met Chinese Premier Li Qiang on the first day of the World Economic Forum meeting on Tuesday.",Reuters,"Tue, 16 Jan 2024 10:28:29 -0500",[],Neutral,Article,"['BAC', 'BX', 'JPM', 'SCBFF']"
https://www.marketwatch.com/story/sec-fines-jpm-morgan-chase-for-whistle-blowing-violation-charge-57f1ceac,https://cdn.snapi.dev/images/v1/q/w/w/bank25-2230649.jpg,SEC fines JPM Morgan Chase for whistle-blowing violation charge,JPMorgan Chase & Co. has agreed to pay an $18 million fine without admitting or denying charges by the U.S. Securities and Exchange Commission that it violated whistleblower protection rules with its confidentiality agreements during a three-year period.,Market Watch,"Tue, 16 Jan 2024 09:23:00 -0500",['paylimitwall'],Negative,Article,['JPM']
https://www.wsj.com/articles/j-p-morgan-securities-to-pay-18-million-for-whistleblower-protection-violations-914edd32,https://cdn.snapi.dev/images/v1/o/w/q/bank46-2230842.jpg,J.P. Morgan Securities to Pay $18 Million for Whistleblower Protection Violations,A JPMorgan Chase subsidiary will pay $18 million to settle charges that it violated protections for whistleblowers.,WSJ,"Tue, 16 Jan 2024 09:13:00 -0500",['paywall'],Negative,Article,['JPM']
https://invezz.com/news/2024/01/16/banks-results-this-earnings-season-the-scars-of-2023/?utm_source=snapi,https://cdn.snapi.dev/images/v1/l/a/y/bank15-2230390.jpg,Banking stocks' financial results this earnings season: the scars of 2023,"This afternoon (or morning if you're in the States), Morgan Stanley and Goldman Sachs posted their financial results for the 2023 FY. The other financial services titans like JPMorgan, Citigroup and Wells Fargo all reported theirs last Friday.",Invezz,"Tue, 16 Jan 2024 08:19:20 -0500",['earnings'],Neutral,Article,"['BAC', 'C', 'GS', 'JPM', 'MS', 'WFC']"
https://www.reuters.com/business/finance/big-us-banks-call-fed-rewrite-contentious-bank-capital-rule-2024-01-16/,https://cdn.snapi.dev/images/v1/6/l/c/bank46-2229948.jpg,Big US banks to call on Fed to rewrite contentious bank capital rule,"Banks on Tuesday will urge the U.S. Federal Reserve to completely overhaul a draft rule hiking bank capital, in the latest leg of Wall Street's effort to water down the Basel Endgame proposal that bankers say will hurt the economy.",Reuters,"Tue, 16 Jan 2024 06:05:17 -0500",[],Negative,Article,"['BAC', 'C', 'GS', 'JPM', 'MS', 'WFC']"
https://www.cnbc.com/2024/01/16/jpmorgan-says-india-is-its-no-1-market-in-asia-and-a-favorite-globally.html,https://cdn.snapi.dev/images/v1/h/n/i/bank41-2229855.jpg,JPMorgan says India is its No. 1 market in Asia; investors are unlikely to return to China this year,"India is JPMorgan's top pick in Asia, and one of its favorite markets globally, according to the investment bank's Asian Equity Strategist Mixo Das.",CNBC,"Tue, 16 Jan 2024 01:52:52 -0500",[],Positive,Article,['JPM']
https://investorplace.com/2024/01/need-to-rebalance-your-portfolio-add-these-3-defensive-stocks-now/,https://cdn.snapi.dev/images/v1/2/a/a/utilities3-2229676.jpg,Need to Rebalance Your Portfolio? Add These 3 Defensive Stocks NOW,"For investors banking on some volatility in 2024, now may be a good time to consider rebalancing one's portfolio. After all, the beginning of the year is often the time many investors consider the balance of their portfolios.",InvestorPlace,"Mon, 15 Jan 2024 18:23:12 -0500",[],Positive,Article,"['D', 'JPM', 'MCD']"
https://finbold.com/sp-500-forecast-for-end-of-2024/?utm_source=snapi,https://cdn.snapi.dev/images/v1/j/k/c/bank32-2229178.jpg,S&P 500 forecast for end of 2024,"Last year, and its final quarter in particular, saw remarkable growth both on the stock market and with numerous cryptocurrencies.",Finbold,"Mon, 15 Jan 2024 08:23:00 -0500",[],Neutral,Article,"['BAC', 'BK', 'C', 'JPM', 'MS', 'SCHW']"
https://www.fool.com/investing/2024/01/15/jpmorgan-chases-moat-revealed-what-investors-can-l/,https://cdn.snapi.dev/images/v1/h/q/5/bank22-2229011.jpg,JPMorgan Chase's Moat Revealed: What Investors Can Learn From the Banking Giant,JPMorgan Chase posted record earnings during 2024. The bank benefitted from higher interest rates and its acquisition of First Republic's assets and deposits.,The Motley Fool,"Mon, 15 Jan 2024 06:41:00 -0500",[],Positive,Article,['JPM']
https://www.marketwatch.com/story/jpmorgan-ceo-jamie-dimon-says-the-economy-is-resilient-how-do-other-banks-feel-about-that-833c5f78,https://cdn.snapi.dev/images/v1/h/1/o/bank45-2228693.jpg,JPMorgan CEO Jamie Dimon says the economy is ‘resilient.' How do other banks feel about that?,"When JPMorgan Chase & Co. JPM, -0.73% reported fourth-quarter results on Friday, Chief Executive Jamie Dimon said the U.S. economy was “resilient,” with management saying a soft landing was likely. Executives at Bank of America Corp. also said they expected a soft landing, while Wells Fargo & Co. said consumer spending “remains strong.",Market Watch,"Sun, 14 Jan 2024 10:01:00 -0500","['CEO', 'paylimitwall']",Positive,Article,['JPM']
https://www.zacks.com/commentary/2209816/breaking-down-early-q4-earnings-results,https://cdn.snapi.dev/images/v1/j/x/d/bank6-2228332.jpg,Breaking Down Early Q4 Earnings Results,"We are off to a good enough start in the Q4 earnings season, though it may be hard to reach that conclusion from the seemingly 'noisy' big bank results.",Zacks Investment Research,"Fri, 12 Jan 2024 21:03:03 -0500",['earnings'],Positive,Article,"['BAC', 'C', 'JPM', 'WFC']"
https://www.zacks.com/commentary/2209716/the-biggest-banks-reported-earnings-today-this-one-is-the-clear-leader,https://cdn.snapi.dev/images/v1/j/7/a/bank9-2228038.jpg,The Biggest Banks Reported Earnings Today: This One is the Clear Leader,"A slew of bank earnings from the largest financial institutions in the world were released this morning, providing insight into their Q4 and 2023 performance.",Zacks Investment Research,"Fri, 12 Jan 2024 15:47:05 -0500",['earnings'],Positive,Article,"['BAC', 'C', 'JPM', 'WFC']"
https://www.marketwatch.com/story/the-consumer-is-fine-says-a-key-jpmorgan-exec-992f775d,https://cdn.snapi.dev/images/v1/3/1/y/bank7-2228029.jpg,"‘The consumer is fine,' says a key JPMorgan exec","The U.S. consumer continues to show signs of health, signaling a soft landing for the economy, as the U.S.'s biggest banks shared a glimpse into their collective crystal ball on Friday.",Market Watch,"Fri, 12 Jan 2024 15:29:00 -0500",['paylimitwall'],Positive,Article,['JPM']
https://www.youtube.com/watch?v=6zyxUHqQPdk,https://cdn.snapi.dev/images/v1/h/x/v/bank47-2227952.jpg,Key takeaways from Big Banks' Q4 earnings results,"The Big Four banks — JPMorgan Chase (JPM), Citigroup (C), Bank of America (BAC), and Wells Fargo (WFC) — released their fourth-quarter earnings Friday morning, some with mixed results. JPMorgan, however, outperformed the competition, reporting a record net income of $49.6 billion — the highest ever for a US bank.",Yahoo Finance,"Fri, 12 Jan 2024 13:59:22 -0500",['earnings'],Positive,Video,"['BAC', 'C', 'JPM', 'WFC']"
https://www.reuters.com/business/finance/us-banking-giants-shed-over-17000-employees-turbulent-year-2024-01-12/,https://cdn.snapi.dev/images/v1/g/1/y/bank4-2227949.jpg,"US banking giants shed over 17,000 employees in turbulent year","Wells Fargo , Bank of America and Citigroup reduced their workforces by a combined 17,700 last year, the banking giants reported in their fourth-quarter earnings on Friday.",Reuters,"Fri, 12 Jan 2024 13:40:51 -0500",[],Negative,Article,"['BAC', 'C', 'JPM', 'WFC']"
https://www.youtube.com/watch?v=zFKjg88uUR4,https://cdn.snapi.dev/images/v1/s/k/j/bank48-2227954.jpg,Breaking down big bank earnings,The Investment Committee breaks down the significant bank earnings and picks their favorite name in the sector.,CNBC Television,"Fri, 12 Jan 2024 13:40:15 -0500",['earnings'],Neutral,Video,"['BAC', 'C', 'JPM', 'KBE', 'WFC']"
https://www.wsj.com/articles/banks-cant-count-on-loans-for-growth-cc1772ce,https://cdn.snapi.dev/images/v1/8/v/w/bank26-2227796.jpg,Banks Can't Count on Loans For Growth,"As interest rates fall, growing loans is getting more important, but also trickier.",WSJ,"Fri, 12 Jan 2024 12:06:00 -0500",['paywall'],Negative,Article,"['BAC', 'C', 'GS', 'JPM', 'MS', 'WFC']"
https://www.zacks.com/stock/news/2209582/jpmorgan-jpm-q4-earnings-beat-on-higher-rates-loans-ib,https://cdn.snapi.dev/images/v1/t/k/n/bank24-2227769.jpg,"JPMorgan (JPM) Q4 Earnings Beat on Higher Rates, Loans & IB","High interest rates, the FRC deal, robust loan balance and decent IB business performance aid JPMorgan's (JPM) Q4 earnings. Rising credit costs and weakness in the trading business act as spoilsports.",Zacks Investment Research,"Fri, 12 Jan 2024 12:02:14 -0500",['earnings'],Positive,Article,['JPM']
https://www.youtube.com/watch?v=kW6aUCj_h8o,https://cdn.snapi.dev/images/v1/p/6/7/bank40-2227795.jpg,"Bank earnings: JPMorgan posts record annual profit, Q4 miss","The country's largest banks reported fourth-quarter earnings on Friday, putting a cap on a volatile 2023. Financial titans JPMorgan Chase (JPM), Citigroup (C), Bank of America (BAC), and Wells Fargo (WFC) released mixed results with varying outperformances and declines.",Yahoo Finance,"Fri, 12 Jan 2024 11:58:56 -0500",['earnings'],Neutral,Video,['JPM']
https://seekingalpha.com/article/4662556-jpmorgan-chase-and-co-jpm-q4-2023-earnings-call-transcript,https://cdn.snapi.dev/images/v1/i/p/p/bank25-2227790.jpg,JPMorgan Chase & Co. (JPM) Q4 2023 Earnings Call Transcript,JPMorgan Chase & Co. (JPM) Q4 2023 Earnings Call Transcript,Seeking Alpha,"Fri, 12 Jan 2024 11:40:23 -0500","['CallScript', 'earnings', 'paylimitwall']",Neutral,Article,['JPM']
https://www.pymnts.com/earnings/2024/jpmorgan-earnings-credit-and-debit-spend-surges-7/?utm_source=snapi,https://cdn.snapi.dev/images/v1/w/l/z/bank13-2227735.jpg,JPMorgan Earnings: Credit and Debit Spend Surges 7%,"Earnings season's here, with JPMorgan among the most visible names reporting Friday morning (Jan. 12).  And the big bank's metrics are showing evidence that consumer spending is still strong.",PYMNTS,"Fri, 12 Jan 2024 11:34:09 -0500",['earnings'],Positive,Article,['JPM']
https://www.marketbeat.com/originals/20-upside-for-jpmorgan-chase-stock-heres-how/?utm_source=snapi,https://cdn.snapi.dev/images/v1/8/o/i/bank1-2227620.jpg,20% upside for JPMorgan Chase stock? Here's how,"Shares of JPMorgan Chase & Co. NYSE: JPM surged more than 5% immediately following the Q4 earnings release. The release aside, the move higher has extremely bullish implications for this market, which could move significantly higher over the next two quarters.",MarketBeat,"Fri, 12 Jan 2024 10:45:03 -0500",[],Positive,Article,['JPM']
https://www.youtube.com/watch?v=koTfT0GU6eg,https://cdn.snapi.dev/images/v1/b/s/u/bank38-2227651.jpg,"Investment banking is setup for a good year, says CFRA's Ken Leon",Baird's David George and CFRA's Ken Leon join 'Squawk on the Street' to discuss how investors should be positioning in big banks.,CNBC Television,"Fri, 12 Jan 2024 10:43:28 -0500",[],Positive,Video,"['BAC', 'C', 'GS', 'JPM', 'MS', 'WFC']"
https://www.zacks.com/stock/news/2209485/jpmorgan-chase-co-jpm-q4-earnings-taking-a-look-at-key-metrics-versus-estimates,https://cdn.snapi.dev/images/v1/h/q/t/bank44-2227553.jpg,JPMorgan Chase & Co. (JPM) Q4 Earnings: Taking a Look at Key Metrics Versus Estimates,"While the top- and bottom-line numbers for JPMorgan Chase & Co. (JPM) give a sense of how the business performed in the quarter ended December 2023, it could be worth looking at how some of its key metrics compare to Wall Street estimates and year-ago values.",Zacks Investment Research,"Fri, 12 Jan 2024 10:32:18 -0500",['earnings'],Neutral,Article,['JPM']
https://www.youtube.com/watch?v=MQ-D5086nJc,https://cdn.snapi.dev/images/v1/j/1/e/bank37-2227611.jpg,JPMorgan Posts Record Net Interest Income in Fourth Quarter,JPMorgan Chase & Co. delivered its seventh consecutive quarter of record net interest income and a surprise forecast that the windfall may continue this year. Sonali Basak reports on Bloomberg Television.,Bloomberg Markets and Finance,"Fri, 12 Jan 2024 10:21:47 -0500",['earnings'],Positive,Video,['JPM']
https://www.reuters.com/business/finance/big-us-bank-profits-fall-insurance-fund-charges-falling-lending-margins-2024-01-12/,https://cdn.snapi.dev/images/v1/u/c/r/bank41-2227548.jpg,"Big U.S. bank profits fall on insurance fund charges, falling lending margins",The country's largest lenders showed signs that a boost from high Federal Reserve interest rates that had allowed them to make more on lending may be fading.,Reuters,"Fri, 12 Jan 2024 09:50:29 -0500",[],Negative,Article,"['BAC', 'C', 'JPM', 'WFC']"
https://nypost.com/2024/01/12/business/jpmorgan-posts-record-profits-for-2023-despite-15-drop-in-q4/,https://cdn.snapi.dev/images/v1/v/u/a/bank33-2227498.jpg,JPMorgan posts record profits for 2023 despite drop in fourth quarter,"JPMorgan Chase's total net income for the year came in at $49.6 billion, the most ever in the history of American banking.",New York Post,"Fri, 12 Jan 2024 09:49:34 -0500",['earnings'],Positive,Article,['JPM']
https://www.zacks.com/stock/news/2209375/jpmorgan-chase-co-jpm-surpasses-q4-earnings-estimates,https://cdn.snapi.dev/images/v1/v/r/n/bank30-2227489.jpg,JPMorgan Chase & Co. (JPM) Surpasses Q4 Earnings Estimates,"JPMorgan Chase & Co. (JPM) came out with quarterly earnings of $3.97 per share, beating the Zacks Consensus Estimate of $3.73 per share. This compares to earnings of $3.57 per share a year ago.",Zacks Investment Research,"Fri, 12 Jan 2024 09:47:25 -0500",['earnings'],Positive,Article,['JPM']
https://www.foxbusiness.com/markets/jpmorgan-profit-shrinks-sets-aside-3-billion-for-deposit-insurance-fund,https://cdn.snapi.dev/images/v1/5/c/l/bank19-2227379.jpg,JPMorgan profit shrinks as it sets aside $3B for deposit insurance fund,The largest U.S. lender has benefited from its acquisition of failed First Republic Bank in May that brought in billions of dollars of loans and bolstered its net interest income.,Fox Business,"Fri, 12 Jan 2024 08:41:33 -0500",['earnings'],Positive,Article,['JPM']
https://www.proactiveinvestors.com/companies/news/1038233?SNAPI,https://cdn.snapi.dev/images/v1/f/l/6/bank15-2227341.jpg,JPMorgan records most profitable year in US banking history despite 4Q drop,"JPMorgan Chase & Co (NYSE:JPM) concluded 2023 as the most profitable year in the history of U.S. banking, reporting a record-breaking $49.6 billion in annual net income, a 32% increase from the previous year.",Proactive Investors,"Fri, 12 Jan 2024 08:31:24 -0500",[],Positive,Article,['JPM']
https://www.youtube.com/watch?v=4L9flrfIW_s,https://cdn.snapi.dev/images/v1/y/q/t/bank27-2227392.jpg,Hightower's Stephanie Link on bank earnings: Q4 is typically 'very messy' for banks,"Stephanie Link, Hightower chief investment strategist and portfolio manager, joins 'Squawk Box' to break down the latest bank quarterly earnings results, impact on stock performance outlook, and more.",CNBC Television,"Fri, 12 Jan 2024 08:31:14 -0500",['earnings'],Neutral,Video,"['BAC', 'C', 'GS', 'JPM', 'MS', 'WFC']"
https://www.investopedia.com/jp-morgan-s-q4-hit-by-fdic-special-assessment-but-net-interest-income-beats-expectations-8424288,https://cdn.snapi.dev/images/v1/7/b/d/bank12-2227330.jpg,"JP Morgan's Q4 Hit By FDIC Special Assessment, But Net Interest Income Beats Expectations",JPMorgan Chase & Co.'s (JPM) fourth-quarter profit fell due to an FDIC special assessment but high interest rates propelled net interest income. JPMorgan shares were up 2% in pre-market trading.,Investopedia,"Fri, 12 Jan 2024 08:20:42 -0500",['earnings'],Neutral,Article,['JPM']
https://www.wsj.com/articles/jpmorganchase-jpm-q4-earnings-report-2023-f29ff050,https://cdn.snapi.dev/images/v1/e/3/b/bank10-2227272.jpg,JPMorgan Profit Slips But Bank Still Posts Most Profitable Year Ever,"The biggest bank in the U.S. has benefited from rising interest rates lifting its lending income, which has climbed faster than expected.",WSJ,"Fri, 12 Jan 2024 07:54:00 -0500","['earnings', 'paywall']",Positive,Article,['JPM']
https://www.youtube.com/watch?v=FR_IKr_TuPk,https://cdn.snapi.dev/images/v1/c/4/v/bank23-2227261.jpg,JPMorgan Chase profit falls after $2.9 billion fee from regional bank rescues,CNBC's Joe Kernen reports on the bank's quarterly earnings results.,CNBC Television,"Fri, 12 Jan 2024 07:46:57 -0500",['earnings'],Negative,Video,['JPM']
https://www.youtube.com/watch?v=lnAASaGvbjU,https://cdn.snapi.dev/images/v1/r/y/5/bank25-2227267.jpg,"JPMorgan is the bellwether for bank earnings this quarter, says Stephen Biggar","Stephen Biggar, Director of Financial Institutions Research at Argus Research, tees up the big bank earnings out today.",CNBC Television,"Fri, 12 Jan 2024 07:32:58 -0500",['earnings'],Positive,Video,['JPM']
https://www.youtube.com/watch?v=HSXbym3CST4,https://cdn.snapi.dev/images/v1/b/s/k/bank21-2227197.jpg,JPMorgan Misses Estimates on 4Q Investment Banking Revenue,JPMorgan Chase & Co. reported fourth-quarter investment banking revenue that fell short of estimates at $1.58 billion. Sonali Basak and Jonathan Ferro examine the numbers on Bloomberg Television.,Bloomberg Markets and Finance,"Fri, 12 Jan 2024 07:15:43 -0500",['earnings'],Negative,Video,['JPM']
https://www.marketwatch.com/story/jpmorgan-chase-net-income-drops-but-beats-analyst-estimates-2af8878b,https://cdn.snapi.dev/images/v1/y/o/x/bank3-2227173.jpg,JPMorgan Chase net income drops but beats analyst estimates,"JPMorgan Chase & Co. JPM, -0.42% said Friday its fourth-quarter net income fell to $9.3 billion, or $3.04 a share, from $11 billion, or $3.57 a share, in the year-ago quarter. Excluding one-time items, fourth-quarter profit totaled $3.97 a share, well ahead of the FactSet consensus estimate of $3.35 a share.",Market Watch,"Fri, 12 Jan 2024 07:00:00 -0500","['earnings', 'paylimitwall']",Positive,Article,['JPM']
https://www.businesswire.com/news/home/20240112807740/en/JPMorgan-Chase-Reports-Fourth-Quarter-and-Full-Year-2023-Financial-Results/,https://cdn.snapi.dev/images/v1/t/v/press10-2227167.jpg,JPMorgan Chase Reports Fourth-Quarter and Full-Year 2023 Financial Results,"NEW YORK--(BUSINESS WIRE)--JPMorgan Chase & Co. has released its fourth-quarter and full-year 2023 financial results. Results can be found at the Firm's Investor Relations website at jpmorganchase.com/ir/quarterly-earnings. JPMorgan Chase & Co. (NYSE: JPM) is a leading financial services firm based in the United States of America (“U.S.”), with operations worldwide. JPMorgan Chase had $3.9 trillion in assets and $328 billion in stockholders' equity as of December 31, 2023. The Firm is a.",Business Wire,"Fri, 12 Jan 2024 06:59:00 -0500","['earnings', 'PressRelease']",Neutral,Article,['JPM']
https://www.reuters.com/business/finance/jpmorgans-profit-shrinks-it-refills-deposit-insurance-fund-2024-01-12/,https://cdn.snapi.dev/images/v1/b/t/w/bank48-2227138.jpg,JPMorgan's profit shrinks as it refills deposit insurance fund,JPMorgan Chase's profit fell in the fourth quarter as the lender set aside nearly $3 billion to help refill a fund used to backstop failed banks that was drained after regional lenders collapsed last year.,Reuters,"Fri, 12 Jan 2024 06:56:57 -0500",['earnings'],Negative,Article,['JPM']
https://investorplace.com/2024/01/the-3-best-dow-stocks-to-buy-in-january-2024/,https://cdn.snapi.dev/images/v1/l/k/v/communication26-2227015.jpg,The 3 Best Dow Stocks to Buy in January 2024,"With the Dow Industrial Average underperforming the S&P 500 in 2023, now is a great time to consider the best Dow stocks to buy. The Dow, a benchmark index of 30 prominent companies, is often a barometer for strength of the U.S. stock market.",InvestorPlace,"Fri, 12 Jan 2024 05:04:00 -0500",['StocksToWatch'],Positive,Article,"['CSCO', 'JPM', 'MSFT']"
https://www.zacks.com/stock/news/2209130/q4-earnings-from-wall-street-on-deck-jpmorgan-citi-bofa-and-wells-fargo,https://cdn.snapi.dev/images/v1/j/q/z/bank11-2226803.jpg,"Q4 Earnings from Wall Street On Deck: JPMorgan, Citi, BofA and Wells Fargo","We turn our attention to Q4 earnings season, which picks up steam Friday morning before the opening bell.",Zacks Investment Research,"Thu, 11 Jan 2024 18:48:33 -0500",['earnings'],Neutral,Article,"['BAC', 'C', 'DAL', 'JPM', 'UNH', 'WFC']"
https://www.pymnts.com/earnings/2024/bank-earnings-offer-insight-into-digital-pivots-loan-charge-offs/?utm_source=snapi,https://cdn.snapi.dev/images/v1/g/y/m/bank5-2226687.jpg,Bank Earnings to Offer Insight Into Digital Pivots and Loan Charge-Offs,"Every three months, like clockwork, the earnings roll in. And every three months, the big banks usher in the “official” start of earnings season.",PYMNTS,"Thu, 11 Jan 2024 16:50:17 -0500",['earnings'],Positive,Article,"['BAC', 'C', 'GS', 'JPM', 'MS', 'WFC']"
