news_url,image_url,title,text,source_name,date,topics,sentiment,type,tickers
https://www.reuters.com/business/finance/nycb-closes-sale-mortgage-warehouse-loans-jpmorgan-chase-2024-07-22/,https://cdn.snapi.dev/images/v1/x/c/asset-management17-2537963.jpg,NYCB closes sale of about $6 bln mortgage warehouse loans to JPMorgan Chase,Regional lender New York Community Bancorp said on Monday it had closed the sale of about $5.9 billion in mortgage warehouse loans to Wall Street giant JPMorgan Chase.,Reuters,"Mon, 22 Jul 2024 18:36:33 -0400",[],Neutral,Article,"['NYCB', 'JPM']"
https://www.fool.com/investing/2024/07/22/jpmorgan-chase-soared-20-in-the-first-half-of-2024/,https://cdn.snapi.dev/images/v1/u/v/chhase7-2459780-2536172.jpg,JPMorgan Chase Soared 20% in the 1st Half of 2024. Is It Still a Buy?,JPMorgan Chase delivered a 20% total return for investors in the first half of 2024 despite the persistent high-rate environment. The strong returns are likely due to a combination of strong business performance and improving investor sentiment towards the banking industry.,The Motley Fool,"Mon, 22 Jul 2024 07:02:00 -0400",[],Positive,Article,['JPM']
https://www.reuters.com/business/finance/jpmorgan-says-majority-atms-operating-normally-amid-outages-2024-07-19/,https://cdn.snapi.dev/images/v1/3/e/3eddw1-2489717-2535155.jpg,JPMorgan says majority of ATMs operating normally amid outages,"JPMorgan Chase said it is working to restore service to automated teller machines (ATMs) affected by a global digital outage while a majority of its ATMs are operating normally, according to an emailed statement on Friday.",Reuters,"Fri, 19 Jul 2024 18:27:42 -0400",[],Neutral,Article,['JPM']
https://investorplace.com/2024/07/3-dow-stocks-to-buy-now-q3-edition/,https://cdn.snapi.dev/images/v1/x/z/semi14-2534519.jpg,3 Dow Stocks to Buy Now: Q3 Edition,"With a violent growth-to-value rotation hitting the stock markets, it can be tempted to ditch AI high-flyers and other frothy tech plays for the big blue chips. When it comes to time-tested blue chips, the Dow Jones Industrial Average is a good place to look.",InvestorPlace,"Fri, 19 Jul 2024 13:00:00 -0400",['StocksToWatch'],Neutral,Article,"['INTC', 'JPM', 'UNH']"
https://www.fool.com/investing/2024/07/19/credit-card-charge-offs-rose-in-the-first-half-of/,https://cdn.snapi.dev/images/v1/n/v/chhase5-2468366-2533570.jpg,Credit Card Charge-Offs Rose in the First Half of 2024. Is JPMorgan Chase Bracing for a Recession?,JPMorgan Chase charged off $1.8 billion in card loans in the second quarter. Charge-offs on credit card loans have risen the past two years.,The Motley Fool,"Fri, 19 Jul 2024 06:30:00 -0400",[],Neutral,Article,['JPM']
https://investorplace.com/2024/07/3-stocks-to-invest-in-for-post-war-rebuilding/,https://cdn.snapi.dev/images/v1/a/y/bank25-2532368.jpg,3 Stocks to Invest In for Post-War Rebuilding,"With both the war in Ukraine and Israel dragging on and causing untold destruction, the dollar amount of damages to housing infrastructure in business simply cannot be calculated. While these events are indisputable tragedies, they do result in the unavoidable reality of reconstruction.",InvestorPlace,"Thu, 18 Jul 2024 13:21:05 -0400",[],Negative,Article,"['JPM', 'NSRGY', 'UL']"
https://www.zacks.com/stock/news/2304727/jpmorgan-chase-co-jpm-is-up-0-07-in-one-week-what-you-should-know?cid=CS-STOCKNEWSAPI-FT-tale_of_the_tape|yseop_template_10-2304727,https://cdn.snapi.dev/images/v1/a/n/chhase12-2448793-2532323.jpg,JPMorgan Chase & Co. (JPM) Is Up 0.07% in One Week: What You Should Know,Does JPMorgan Chase & Co. (JPM) have what it takes to be a top stock pick for momentum investors? Let's find out.,Zacks Investment Research,"Thu, 18 Jul 2024 13:02:41 -0400",[],Positive,Article,['JPM']
https://www.zacks.com/stock/news/2304582/dow-achieves-new-milestone-regains-momentum-for-2h-5-picks?cid=CS-STOCKNEWSAPI-FT-analyst_blog|investment_ideas-2304582,https://cdn.snapi.dev/images/v1/r/g/computer-electronic20-2531748.jpg,"Dow Achieves New Milestone, Regains Momentum for 2H: 5 Picks","We have narrowed our search to five Dow stocks. These are: AMZN, AAPL, WMT, HON, JPM.",Zacks Investment Research,"Thu, 18 Jul 2024 10:31:36 -0400",[],Positive,Article,"['AAPL', 'AMZN', 'HON', 'JPM', 'WMT']"
https://www.fool.com/investing/2024/07/18/jamie-dimon-just-gave-investors-a-big-warning-shou/,https://cdn.snapi.dev/images/v1/e/l/chhase2-2472376-2530885.jpg,Jamie Dimon Just Gave Investors a Big Warning -- Should You Be Worried?,"JPMorgan Chase recently reported its second-quarter earnings, and the numbers were generally strong. Despite the recent general market optimism, CEO Jamie Dimon had some words of caution.",The Motley Fool,"Thu, 18 Jul 2024 06:03:00 -0400",['CEO'],Negative,Article,['JPM']
https://www.businessinsider.com/jpmorgan-ceo-jamie-dimon-adding-ai-focused-jobs-5000-2024-7,https://cdn.snapi.dev/images/v1/0/f/chhase7-2459780-2530624.jpg,JPMorgan CEO Jamie Dimon says he'll add thousands of jobs focused on AI in the next couple of years,"JPMorgan CEO Jamie Dimon is a huge believer in artificial intelligence's impact on the workforce. The CEO recently told LinkedIn that his company has around 2,000 people focused on AI.",Business Insider,"Wed, 17 Jul 2024 21:53:10 -0400","['CEO', 'paywall']",Positive,Article,['JPM']
https://seekingalpha.com/article/4704696-jpmorgan-citigroup-earnings-summaries-like-both-but-citigroup-cheaper-longer-term-play,https://cdn.snapi.dev/images/v1/i/a/citi2-2483416-2530522.jpg,"JPMorgan And Citigroup Earnings Summaries: Like Both, But Citigroup Is A Cheaper, Longer-Term Play","JPM is “winning” for its shareholders, while Jane Fraser continues to turn around Citigroup. Coming into last Friday morning's call, our revenue estimate for JPM was $42 billion and change, but that estimate was actually revised up on Thursday. Citi's net revenue grew 3% YoY, while EPS grew 14% YoY, with an 8% EPS upside surprise.",Seeking Alpha,"Wed, 17 Jul 2024 20:00:00 -0400","['earnings', 'paylimitwall']",Positive,Article,"['C', 'JPM']"
https://www.zacks.com/stock/news/2303871/3-best-earnings-growth-stocks-to-invest-in-nflx-jpm-dy?cid=CS-STOCKNEWSAPI-FT-analyst_blog|rw-2303871,https://cdn.snapi.dev/images/v1/i/m/machinery-construction8-2530004.jpg,"3 Best Earnings Growth Stocks to Invest in: NFLX, JPM, DY","Invest in stocks such as Netflix (NFLX), JPMorgan Chase (JPM) and Dycom Industries (DY) for solid earnings growth.",Zacks Investment Research,"Wed, 17 Jul 2024 15:45:47 -0400",['earnings'],Positive,Article,"['DY', 'JPM', 'NFLX']"
https://www.proactiveinvestors.co.uk/companies/news/1052096?SNAPI,https://cdn.snapi.dev/images/v1/r/3/chhase3-2472051-2528312.jpg,Trump considering JP Morgan's Dimon for Treasury Secretary,"Donald Trump has stated he will not seek to remove Federal Reserve chair Jerome Powell before his term ends and would consider JPMorgan CEO Jamie Dimon for Treasury Secretary if he wins the November 5 election, according to a Bloomberg interview. JPMorgan declined to comment.",Proactive Investors,"Wed, 17 Jul 2024 04:02:36 -0400",[],Positive,Article,['JPM']
https://www.zacks.com/stock/news/2302371/4-blue-chip-stocks-to-bet-on-as-dow-hits-fresh-all-time-high?cid=CS-STOCKNEWSAPI-FT-analyst_blog|investment_ideas-2302371,https://cdn.snapi.dev/images/v1/r/6/7/ksnckw-2494625-2526596.jpg,4 Blue-Chip Stocks to Bet on as Dow Hits Fresh All-Time High,"Stocks like JPMorgan Chase & Co. (JPM), Amazon.com, Inc. (AMZN), Apple Inc. (AAPL) and Walmart, Inc. (WMT) are likely to benefit from the Dow's ongoing rally.",Zacks Investment Research,"Tue, 16 Jul 2024 09:15:38 -0400",[],Positive,Article,"['AAPL', 'AMZN', 'JPM', 'WMT']"
https://seekingalpha.com/article/4704196-jpmorgan-chase-stock-likely-fairly-valued-but-well-positioned-keep-gaining-market-share,https://cdn.snapi.dev/images/v1/i/w/chhase2-2472376-2525889.jpg,"JPMorgan Chase: Likely Fairly Valued, But Well-Positioned To Keep Gaining Market Share","JPMorgan Chase outperformed on core earnings in Q2'24, with strong capital markets revenue offsetting weaker lending activity and higher provisioning. Capital markets should remain strong in 2024 and asset repricing at higher rates is a positive, but 2023-2026 pre-provision profit growth is likely to be lackluster despite strong ROTCEs. JPMorgan is almost untouchable from a quality standpoint and is well-placed to continue gaining share in banking, asset management, and payments, but the valuation is more ""fair"" than ""discounted"" now.",Seeking Alpha,"Mon, 15 Jul 2024 23:18:57 -0400",['paylimitwall'],Positive,Article,['JPM']
https://www.cnbc.com/2024/07/15/cramer-names-stocks-that-could-rally-or-fall-if-trump-wins-in-2024.html,https://cdn.snapi.dev/images/v1/u/k/gen25-2482913-2525777.jpg,"Jim Cramer names stocks that could rally, or fall, during another Trump presidency","CNBC's Jim Cramer on Monday named stocks that could stand to see gains if former President Donald Trump returns to office, as well as ones that may notch losses. ""After this weekend, it sure seems like the Trump stocks are back,"" he said.",CNBC,"Mon, 15 Jul 2024 19:20:33 -0400",['cramer'],Positive,Article,"['ACI', 'BAC', 'CPRI', 'ENPH', 'GS', 'JPM', 'KR', 'MS', 'NOVA', 'RUN', 'SEDG', 'TPR']"
https://www.marketwatch.com/story/bank-bond-spreads-tighten-as-earnings-spark-buying-ahead-of-fresh-debt-offerings-ad8df03a,https://cdn.snapi.dev/images/v1/p/d/bank21-2525222.jpg,Bank bond spreads tighten as earnings spark buying ahead of fresh debt offerings,"Bond yields for three of the four biggest money-center banks have continued to tighten against Treasurys following their earnings updates, in a positive sign of demand ahead of billions of dollars in fresh debt expected from the banks.",Market Watch,"Mon, 15 Jul 2024 14:17:00 -0400",['paylimitwall'],Positive,Article,"['BAC', 'C', 'GS', 'JPM', 'MS', 'WFC']"
https://www.pymnts.com/connectedeconomy/2024/ce-100-index-gains-1-3-as-big-banks-post-earnings/?utm_source=snapi,https://cdn.snapi.dev/images/v1/h/s/bank1-2523843.jpg,CE 100 Index Gains 1.3% as Big Banks Post Earnings,"Earnings season is in full swing, as big banks – specifically, JPMorgan and Citigroup – helped sway the fortunes of the CE 100 Index. The Index was up 1.",PYMNTS,"Mon, 15 Jul 2024 04:00:31 -0400",['earnings'],Positive,Article,"['C', 'JPM']"
https://www.cnbc.com/2024/07/14/top-wall-street-analysts-pound-the-table-on-these-3-dividend-stocks.html,https://cdn.snapi.dev/images/v1/9/u/bank37-2523423.jpg,Top Wall Street analysts are pounding the table on these 3 dividend stocks,"TipRanks' analyst ranking service pinpoints Wall Street's best-performing stocks, including Walmart and JPMorgan Chase.",CNBC,"Sun, 14 Jul 2024 06:37:43 -0400",['dividend'],Positive,Article,"['JPM', 'NOG', 'WMT']"
https://invezz.com/news/2024/07/13/quint-tatro-reacts-to-jpmorgan-q2-earnings-report-2024/?utm_source=snapi,https://cdn.snapi.dev/images/v1/g/c/chhase10-2452083-2523231.jpg,Quint Tatro: JPMorgan is my favourite bank stock but I'm still trimming JPM,Quint Tatro – the founder of Joule Financial is trimming his stake in JPMorgan Chase & Co even though it continues to be his favourite bank stock to own. The financial services behemoth reported its quarterly results on Friday.,Invezz,"Sat, 13 Jul 2024 15:22:54 -0400",[],Positive,Article,['JPM']
https://www.investors.com/news/dow-jones-giants-tesla-rival-stocks-near-buy-points/,https://cdn.snapi.dev/images/v1/e/4/catalog-mail3-2523128.jpg,Two Dow Jones Giants And Tesla's Archrival Lead Five Stocks Near Buy Points,Amazon.com and JPMorgan Chase lead a Group of Five stocks to keep tabs on this week amid market role reversal.,Investors Business Daily,"Sat, 13 Jul 2024 08:00:38 -0400",[],Neutral,Article,"['AMZN', 'BYDDY', 'FTI', 'JPM', 'KBH']"
https://www.zacks.com/commentary/2301203/q2-earnings-growth-expected-to-reach-two-year-high?cid=CS-STOCKNEWSAPI-FT-earnings_preview-2301203,https://cdn.snapi.dev/images/v1/m/l/bank5-2522931.jpg,Q2 Earnings Growth Expected to Reach Two-Year High,"We see the Q2 results from the major banks as good enough - not great, but definitely not bad either. The stocks' outperformance entering this reporting cycle contributed to the market's tentative initial reaction to the results.",Zacks Investment Research,"Fri, 12 Jul 2024 19:17:06 -0400",['earnings'],Positive,Article,"['C', 'JPM', 'WFC']"
https://www.investopedia.com/big-bank-earnings-jpmorgan-citigroup-wells-fargo-q2-2024-8677323,https://cdn.snapi.dev/images/v1/g/r/bank2-2522836.jpg,What We Learned From Big Bank Earnings Friday,Earnings at two of the three large U.S. banks that traditionally launch the financial sector's quarterly earnings season exceeded investors' expectations Friday. But their income statements revealed the ongoing toll of higher interest rates and reflected concerns about a cooling economy.,Investopedia,"Fri, 12 Jul 2024 18:20:36 -0400",['earnings'],Neutral,Article,"['C', 'JPM', 'WFC']"
https://seekingalpha.com/article/4703810-jpmorgan-chase-building-consistency-and-shareholder-trust,https://cdn.snapi.dev/images/v1/u/j/chhase11-2450976-2522806.jpg,JPMorgan Chase: Building Consistency And Shareholder Trust,"JPMorgan Chase & Co.'s second quarter earnings report fell short of expectations, but the stock price only dropped slightly. Management is focused on maintaining a return on equity of 17% or higher, with plans to outperform the industry even in a downturn. Concerns about potential tax increases, an inverted yield curve, and rising deposit costs are being addressed.",Seeking Alpha,"Fri, 12 Jul 2024 17:56:31 -0400",['paylimitwall'],Neutral,Article,['JPM']
https://www.youtube.com/watch?v=rjkZDsamo5w,https://cdn.snapi.dev/images/v1/y/m/f/bank7-2522719.jpg,Chase may start charging for checking accounts,Chase Bank warned customers that checking accounts might not be free in the future.,The Street,"Fri, 12 Jul 2024 16:32:10 -0400",[],Negative,Video,['JPM']
https://www.kiplinger.com/investing/stocks/stock-market-today-markets-hit-fresh-highs-on-rate-cut-optimism,https://cdn.snapi.dev/images/v1/a/f/bank9-2524854.jpg,Stock Market Today: Markets Bounce Back on Rate-Cut Optimism,The latest readings on consumer sentiment and inflation helped lift the odds of the Fed easing in September.,Kiplinger,"Fri, 12 Jul 2024 16:09:00 -0400",['marketclose'],Positive,Article,"['JPM', 'WFC']"
https://www.youtube.com/watch?v=BzfpuOe7j4c,https://cdn.snapi.dev/images/v1/p/j/9/bank3-2522714.jpg,Big banks under pressure: Here's what you need to know,"David Konrad, KBW managing director, joins 'Power Lunch' to discuss his takeaways from big bank earnings.",CNBC Television,"Fri, 12 Jul 2024 15:54:47 -0400",[],Negative,Video,"['C', 'JPM', 'WFC']"
https://www.youtube.com/watch?v=c_UNI86njs4,https://cdn.snapi.dev/images/v1/i/2/h/drug1-2522635.jpg,"Three-Stock Lunch: JPMorgan, Johnson & Johnson and On Holding","Quint Tatro, Joule Financial founder and president, joins 'Power Lunch' to discuss stock plays for three stocks.",CNBC Television,"Fri, 12 Jul 2024 15:52:39 -0400",[],Neutral,Video,"['JNJ', 'JPM', 'ONON']"
https://www.fool.com/investing/2024/07/12/why-jp-morgan-chase-stock-is-down-today/,https://cdn.snapi.dev/images/v1/t/s/chhase6-2460336-2522495.jpg,Why JP Morgan Chase Stock Is Down Today,"JP Morgan Chase beat top- and bottom-line estimates in its latest earnings report. CEO Jamie Dimon said he remains ""vigilant"" about potential risks.",The Motley Fool,"Fri, 12 Jul 2024 14:02:33 -0400",[],Neutral,Article,['JPM']
https://www.zacks.com/stock/news/2301091/jpmorgan-jpm-plans-to-grow-consumer-deposit-market-share?cid=CS-STOCKNEWSAPI-FT-analyst_blog|company_news_finance_sector-2301091,https://cdn.snapi.dev/images/v1/a/9/chhase15-2447447-2522437.jpg,JPMorgan (JPM) Plans to Grow Consumer Deposit Market Share,JPMorgan (JPM) intends to grow its U.S. consumer deposit market share to 15%. This aligns with the bank's initiatives to maintain its industry-leading position in the upcoming years.,Zacks Investment Research,"Fri, 12 Jul 2024 13:26:04 -0400",[],Positive,Article,['JPM']
https://nypost.com/2024/07/12/business/jpmorgan-ceo-warns-inflation-and-rates-may-stay-higher-for-longer/,https://cdn.snapi.dev/images/v1/y/n/chhase8-2457419-2522386.jpg,JPMorgan CEO Jamie Dimon warns inflation and interest rates may stay higher for longer than expected,"JPMorgan Chase, Wells Fargo and Citigroup exceeded LSEG analysts' second-quarter expectations.",New York Post,"Fri, 12 Jul 2024 13:04:22 -0400",['CEO'],Negative,Article,['JPM']
https://www.marketwatch.com/story/5-things-investors-learned-from-jpmorgan-chases-earnings-edfc2184,https://cdn.snapi.dev/images/v1/k/g/chhase10-2452083-2522415.jpg,5 things investors learned from JPMorgan Chase's earnings,"JPMorgan Chase & Co. beat revenue estimates and reported a higher profit for the second quarter when including one-time items such as its sale of stock in Visa Inc., but the bank put aside more money to cover credit-card losses as higher-for-longer interest rates weigh on consumers.",Market Watch,"Fri, 12 Jul 2024 12:45:00 -0400","['earnings', 'paylimitwall']",Positive,Article,['JPM']
https://www.youtube.com/watch?v=alZMUJmGjS4,https://cdn.snapi.dev/images/v1/q/3/4/catalog-mail8-2522253.jpg,"ASML, JPM, AMZN: Stocks to Watch & Technical Trends","ASML (ASML) had a huge run up this week as it broke out of the previous all-time high, notes Joe Tigay. He and Ben Lichtenstein discuss today's Big Three: ASML, JPMorgan Chase (JPM), and Amazon (AMZN).",Schwab Network,"Fri, 12 Jul 2024 12:15:22 -0400",['StocksToWatch'],Positive,Video,"['AMZN', 'ASML', 'JPM']"
https://www.youtube.com/watch?v=H73dURdoiSM,https://cdn.snapi.dev/images/v1/2/t/e/bank37-2522379.jpg,"WFC, JPM: Financials are Going to Have a Tough Time in 2024","I think financials in general are going to have a tough time in back half of 2024, notes Adam Coons. He discusses bank earnings, highlighting the moves in Wells Fargo (WFC) and JPMorgan Chase (JPM).",Schwab Network,"Fri, 12 Jul 2024 12:05:41 -0400",[],Negative,Video,"['JPM', 'WFC']"
https://www.youtube.com/watch?v=t3tFyD1gP2M,https://cdn.snapi.dev/images/v1/1/t/g/bank33-2522260.jpg,"JPMorgan, Wells Fargo, and Citi kick off earnings with Q2 beats","Erika Najarian, UBS managing director, joins 'Squawk on the Street' to discuss second-quarter earnings reports from JPMorgan, Wells Fargo, and Citi.",CNBC Television,"Fri, 12 Jul 2024 12:04:07 -0400",['earnings'],Positive,Video,"['C', 'JPM', 'WFC']"
https://www.benzinga.com/news/earnings/24/07/39752731/nasdaq-surges-1-jpmorgan-posts-upbeat-earnings?utm_source=snapi,https://cdn.snapi.dev/images/v1/i/r/chhase7-2459780-2522259.jpg,Nasdaq Surges 1%; JPMorgan Posts Upbeat Earnings,"U.S. stocks traded higher midway through trading, with the Nasdaq Composite gaining around 1% on Friday.",Benzinga,"Fri, 12 Jul 2024 12:00:18 -0400",['earnings'],Positive,Article,['JPM']
https://www.kiplinger.com/investing/stocks/jp-morgan-chase-q2-earnings-buy-sell-or-hold,https://cdn.snapi.dev/images/v1/4/e/chhase6-2460336-2522240.jpg,JP Morgan Chase Tops Q2 Expectations: What to Know,JP Morgan Chase released its second-quarter earnings results. Here's what you need to know.,Kiplinger,"Fri, 12 Jul 2024 11:50:35 -0400",['earnings'],Positive,Article,['JPM']
https://seekingalpha.com/article/4703766-jpmorgan-chase-and-co-jpm-q2-2024-earnings-call-transcript,https://cdn.snapi.dev/images/v1/t/r/transcript49-1836312-2522395.jpg,JPMorgan Chase & Co. (JPM) Q2 2024 Earnings Call Transcript,JPMorgan Chase & Co. (JPM) Q2 2024 Earnings Call Transcript,Seeking Alpha,"Fri, 12 Jul 2024 11:47:07 -0400","['earnings', 'CallScript', 'paylimitwall']",Neutral,Article,['JPM']
https://invezz.com/news/2024/07/12/jpmorgan-q2-2024-results-revenue-soars-with-investment-banking-gains/?utm_source=snapi,https://cdn.snapi.dev/images/v1/r/0/chhase8-2457419-2522446.jpg,JPMorgan Chase Q2 2024 results: Revenue soars with investment banking gains,"JPMorgan Chase reported impressive second-quarter results on Friday, surpassing analysts' expectations in both profit and revenue, driven by a significant surge in investment banking fees. JPMorgan Chase Q2 2024 highlights Strong earnings and revenue growth JPMorgan Chase's earnings for the second quarter jumped 25% from the previous year, reaching $18.15 billion, or $6.12 per share.",Invezz,"Fri, 12 Jul 2024 11:38:56 -0400",['earnings'],Positive,Article,['JPM']
https://www.zacks.com/stock/news/2300874/ppi-swells-higher-big-banks-beat-q2-estimates?cid=CS-STOCKNEWSAPI-FT-ahead_of_wall_street-2300874,https://cdn.snapi.dev/images/v1/e/d/bank30-2522139.jpg,"PPI Swells Higher, Big Banks Beat Q2 Estimates",Today's PPI numbers were not quite as accommodating as yesterday's CPI.,Zacks Investment Research,"Fri, 12 Jul 2024 11:21:22 -0400",['earnings'],Positive,Article,"['C', 'JPM', 'WFC']"
https://www.zacks.com/stock/news/2300950/jpmorgan-s-jpm-q2-earnings-top-estimates-on-solid-ib-trading?cid=CS-STOCKNEWSAPI-FT-analyst_blog|earnings_article-2300950,https://cdn.snapi.dev/images/v1/y/b/chhase13-2448745-2522111.jpg,"JPMorgan's (JPM) Q2 Earnings Top Estimates on Solid IB, Trading","High rates, robust loan balance, a rise in mortgage banking income and solid IB and trading businesses aid JPMorgan's (JPM) Q2 earnings. High credit costs and non-interest expenses are headwinds.",Zacks Investment Research,"Fri, 12 Jul 2024 11:11:41 -0400",['earnings'],Positive,Article,['JPM']
https://www.pymnts.com/earnings/2024/jpmorgan-sees-strong-card-spend-despite-weakness-from-lower-income-consumers/?utm_source=snapi,https://cdn.snapi.dev/images/v1/c/h/chhase7-2459780-2522116.jpg,JPMorgan Sees Strong Card Spend Despite ‘Weakness' From Lower-Income Consumers,"JPMorgan's latest results, released Friday (July 12), showed that consumers continued to use their cards in full force, for both debit and credit payments.",PYMNTS,"Fri, 12 Jul 2024 11:01:17 -0400",['earnings'],Neutral,Article,['JPM']
https://www.investopedia.com/jpmorgan-earnings-q2-fy2024-8677055,https://cdn.snapi.dev/images/v1/k/q/chhase15-2447447-2522038.jpg,JPMorgan's Earnings Beat Estimates in Q2 as Investment Banking Revenue Surges,"JPMorgan Chase (JPM) reported second-quarter results that surpassed analysts' expectations, thanks in part to a surge in investment banking revenue on higher fees and a boost from an exchange of the company's Visa shares.",Investopedia,"Fri, 12 Jul 2024 10:57:17 -0400",['earnings'],Positive,Article,['JPM']
https://www.schaeffersresearch.com/content/news/2024/07/12/options-traders-target-jpmorgan-chase-stock-after-earnings,https://cdn.snapi.dev/images/v1/5/v/chhase11-2450976-2522039.jpg,Options Traders Target JPMorgan Chase Stock After Earnings,JPMorgan Chase & Co.  (NYSE:JPM) reported second-quarter earnings and revenue topped analysts' estimates due to a 52% increase in investment banking fees.,Schaeffers Research,"Fri, 12 Jul 2024 10:57:01 -0400",['earnings'],Positive,Article,['JPM']
https://www.cnbc.com/2024/07/12/jpmorgans-jamie-dimon-warns-inflation-and-interest-rates-may-stay-higher.html,https://cdn.snapi.dev/images/v1/c/5/chhase5-2468366-2522117.jpg,JPMorgan's Jamie Dimon warns inflation and interest rates may stay higher,JPMorgan Chase CEO Jamie Dimon on Friday issued another warning about inflation despite recent signs of easing in price pressures.,CNBC,"Fri, 12 Jul 2024 10:47:00 -0400",['CEO'],Negative,Article,['JPM']
https://www.zacks.com/stock/news/2300730/jpmorgan-chase-co-jpm-reports-q2-earnings-what-key-metrics-have-to-say?cid=CS-STOCKNEWSAPI-FT-fundamental_analysis|nfm-2300730,https://cdn.snapi.dev/images/v1/a/t/chhase3-2472051-2521903.jpg,JPMorgan Chase & Co. (JPM) Reports Q2 Earnings: What Key Metrics Have to Say,"The headline numbers for JPMorgan Chase & Co. (JPM) give insight into how the company performed in the quarter ended June 2024, but it may be worthwhile to compare some of its key metrics to Wall Street estimates and the year-ago actuals.",Zacks Investment Research,"Fri, 12 Jul 2024 10:31:25 -0400",['earnings'],Positive,Article,['JPM']
https://www.marketbeat.com/originals/a-rising-wedge-pattern-signals-reversal-for-this-stock/?utm_source=snapi,https://cdn.snapi.dev/images/v1/3/r/chhase9-2452431-2521823.jpg,A Rising Wedge Pattern Signals Reversal for This Stock,"JPMorgan Chase & Co. NYSE: JPM shows a Rising Wedge Pattern. Like all technical patterns, it is never 100% correct but often signals a bearish reversal in the underlying market.",MarketBeat,"Fri, 12 Jul 2024 10:11:33 -0400",[],Negative,Article,['JPM']
https://www.youtube.com/watch?v=EW6rGYBEJVs,https://cdn.snapi.dev/images/v1/k/m/m/bank15-2521811.jpg,Hightower's Stephanie Link breaks down JPMorgan Chase and Wells Fargo earnings,"Stephanie Link, Hightower chief investment strategist, joins 'Squawk Box' to break down the quarterly earnings results from JPMorgan Chase and Wells Fargo.",CNBC Television,"Fri, 12 Jul 2024 09:55:16 -0400",['earnings'],Neutral,Video,"['JPM', 'WFC']"
https://www.youtube.com/watch?v=757e5xDbRp0,https://cdn.snapi.dev/images/v1/7/y/q/bank12-2521747.jpg,J P Morgan Chase tops second-quarter revenue expectations on strong investment banking,CNBC's Joe Kernen reports on the bank's quarterly earnings results.,CNBC Television,"Fri, 12 Jul 2024 09:51:07 -0400",['earnings'],Positive,Video,['JPM']
https://investorplace.com/2024/07/3-stocks-to-buy-from-the-portfolio-of-wall-streets-best-kept-secret/,https://cdn.snapi.dev/images/v1/0/w/ksnckw-2494625-2521702.jpg,3 Stocks to Buy From the Portfolio of Wall Street's Best Kept Secret,I'm always looking for inspiration when it comes to finding quality stocks to buy. One of the best ways to find some is to check top portfolio managers' holdings.,InvestorPlace,"Fri, 12 Jul 2024 09:29:27 -0400",['StocksToWatch'],Positive,Article,"['AAPL', 'JPM', 'ULTA']"
