news_url,image_url,title,text,source_name,date,topics,sentiment,type,tickers
https://www.reuters.com/business/finance/jpmorgan-chase-pay-100-million-us-regulator-over-trade-reporting-gaps-2024-05-01/,https://cdn.snapi.dev/images/v1/f/8/7/bank15-2404580.jpg,JPMorgan Chase to pay $100 million to US regulator over trade reporting gaps,"JPMorgan Chase expects to enter into a resolution with a third U.S. regulator that will require it to pay a civil penalty of $100 million for reporting incomplete trading data to surveillance platforms, it disclosed in a regulatory filing on Wednesday.",Reuters,"Wed, 01 May 2024 16:40:57 -0400",[],Negative,Article,['JPM']
https://www.reuters.com/business/finance/jpmorgan-says-its-russia-assets-may-be-seized-after-lawsuits-russia-us-2024-05-01/,https://cdn.snapi.dev/images/v1/c/9/z/bank14-2404579.jpg,"JPMorgan says its Russia assets may be seized after lawsuits in Russia, US","JPMorgan Chase said its Russia assets may be seized after lawsuits in Russian and U.S. courts, the bank said in a filing on Wednesday.",Reuters,"Wed, 01 May 2024 16:29:57 -0400",[],Negative,Article,['JPM']
https://investorplace.com/2024/05/stock-market-crash-alert-3-must-buy-blue-chip-stocks-when-prices-plunge/,https://cdn.snapi.dev/images/v1/w/j/w/bank25-2402432.jpg,Stock Market Crash Alert: 3 Must-Buy Blue-Chip Stocks When Prices Plunge,"When the going gets tough, the tough buy blue chip stocks. That's because they are safe havens in times of turmoil.",InvestorPlace,"Wed, 01 May 2024 07:30:00 -0400",[],Positive,Article,"['JPM', 'PG', 'WMT']"
https://www.reuters.com/business/finance/jpmorgan-broadens-roles-sales-executives-2024-04-30/,https://cdn.snapi.dev/images/v1/t/r/c/bank31-2400556.jpg,JPMorgan broadens roles for sales executives,"JPMorgan Chase has expanded the roles of some executives in its sales department, the bank said in an internal memo seen by Reuters on Tuesday.",Reuters,"Tue, 30 Apr 2024 11:45:54 -0400",[],Positive,Article,['JPM']
https://www.marketwatch.com/story/seven-bank-stock-picks-as-industry-nears-positive-inflections-85f2e9a3,https://cdn.snapi.dev/images/v1/h/h/6/bank11-2400302.jpg,Seven bank-stock picks as industry nears ‘positive inflections',"There are always doom-and-gloom warnings in the financial media that the stock market is headed for a tumble, regardless of market conditions. These days, some warnings center on stock valuations appearing to be high relative to expected earnings compared to historical levels.",Market Watch,"Tue, 30 Apr 2024 10:51:00 -0400",['paylimitwall'],Positive,Article,"['BAC', 'C', 'GS', 'JEF', 'JPM', 'MS', 'USB']"
https://www.youtube.com/watch?v=h8RB72t56Ow,https://cdn.snapi.dev/images/v1/x/q/g/airline5-2398030.jpg,"Final Trades: Delta Air Lines, JPMorgan Chase and the IYC",The Investment Committee share their top stocks to watch for the second half.,CNBC Television,"Mon, 29 Apr 2024 14:13:46 -0400",[],Positive,Video,"['DAL', 'IYC', 'JPM']"
https://finbold.com/sell-alert-expert-warns-sp-500-could-crash-44/?utm_source=snapi,https://cdn.snapi.dev/images/v1/c/n/y/bank16-2396908.jpg,Sell alert: Expert warns S&P 500 could crash 44%,"After a broad bloodbath that came with April caused numerous experts, investors, and traders to speculate over how big the correction could be and even whether it would lead to a recession, the later parts of the month somewhat lessened the fears.",Finbold,"Mon, 29 Apr 2024 08:11:41 -0400",[],Negative,Article,"['BAC', 'JPM']"
https://www.marketbeat.com/stock-ideas/is-the-financial-sector-poised-for-a-major-directional-move/?utm_source=snapi,https://cdn.snapi.dev/images/v1/v/h/u/asset-management26-2396739.jpg,Is the Financial Sector Poised for a Major Directional Move?,"The Financial Select Sector SPDR ETF NYSE: XLF has spent several months consolidating above the critical $40 level, resistance from 2021 and early 2022. Now, it's at a critical juncture, only 3.3% off from its all-time high.",MarketBeat,"Mon, 29 Apr 2024 07:31:28 -0400",[],Positive,Article,"['JPM', 'V', 'XLF', 'BRK-A', 'BRK-B']"
https://www.cnbc.com/2024/04/29/uae-minister-jpm-calls-for-reality-check-on-energy-transition-is-sensible.html,https://cdn.snapi.dev/images/v1/l/y/l/bank38-2396407.jpg,"JPMorgan's calls for a reality check on energy transition are sensible, UAE energy minister says","The energy minister of the UAE concurred with JPMorgan's calls for there to be a ""reality check"" on the world's energy transition goals and pathway.",CNBC,"Mon, 29 Apr 2024 02:03:02 -0400",[],Positive,Article,['JPM']
https://www.youtube.com/watch?v=dVR_9cdIrDo,https://cdn.snapi.dev/images/v1/z/t/l/bank45-2396722.jpg,UAE energy minister on JPMorgan urging the need for a 'reality check' on the energy transition,"Suhail Al Mazrouei, the UAE energy minister, comments on JPMorgan calling for a “reality check” on the energy transition.",CNBC International TV,"Mon, 29 Apr 2024 00:57:32 -0400",[],Negative,Video,['JPM']
https://www.businesswire.com/news/home/20240426764371/en/Chase-Opens-Innovative-Branch-in-Bronx%E2%80%99s-Grand-Concourse-Neighborhood/,https://cdn.snapi.dev/images/v1/a/v/press2-2394566.jpg,Chase Opens Innovative Branch in Bronx's Grand Concourse Neighborhood,"NEW YORK--(BUSINESS WIRE)--JPMorgan Chase leaders and community partners cut the ribbon on a new Community Center branch in the Grand Concourse neighborhood of the Bronx. This branch, the second of its kind in the city, is built to expand access to banking, tools and advice to help customers get on a path to financial health and resilience. The Grand Concourse Community Center branch features a team of local financial health experts focused on community engagement, mentorship and advice. The lo.",Business Wire,"Fri, 26 Apr 2024 11:00:00 -0400",['PressRelease'],Neutral,Article,['JPM']
https://247wallst.com/investing/2024/04/26/6-blue-chip-dividend-financials-are-cheap-and-warren-buffett-owns-billions-of-shares/?utm_source=snapi,https://cdn.snapi.dev/images/v1/z/w/p/bank46-2393959.jpg,6 Blue-Chip Dividend Financials Are Cheap and Warren Buffett Owns Billions of Shares,"The company operates through three segments: Credit Card Consumer Banking Commercial Banking The company accepts: Checking accounts Money market deposits, Negotiable order of withdrawals Savings deposits Time deposits Its loan products include: credit card loans, auto and retail banking loans, commercial and multifamily real estate loans, and commercial and industrial loans.",24/7 Wall Street,"Fri, 26 Apr 2024 07:54:35 -0400","['dividend', 'wbuffett']",Positive,Article,"['ALLY', 'BAC', 'C', 'COF', 'JPM', 'WFC']"
https://nypost.com/2024/04/25/business/seizure-of-440m-in-jpmorgan-funds-ordered-in-suit-over-us-russia-sanctions/,https://cdn.snapi.dev/images/v1/o/d/b/bank39-2391338.jpg,Court orders seizure of $440M JPMorgan funds in lawsuit over US-Russia sanctions,"A Russian court ordered the seizure of $439.5 million in funds from JPMorgan Chase's bank accounts in Russia that the largest American lender froze after the Ukraine invasion, according to a court filing. The court's ruling Wednesday comes after state-owned VTB Bank filed a lawsuit in a St.",New York Post,"Thu, 25 Apr 2024 09:49:18 -0400",[],Negative,Article,['JPM']
https://www.fool.com/investing/2024/04/24/these-are-the-10-high-profile-stocks-us-politician/,https://cdn.snapi.dev/images/v1/j/x/u/computer-electronic15-2387461.jpg,These Are the 10 High-Profile Stocks U.S. Politicians Have Gravitated to Most Over the Last 3 Years,More lawmakers traded these stocks than any others over the last three years. The list includes big winners such as Microsoft and Nvidia.,The Motley Fool,"Wed, 24 Apr 2024 06:10:00 -0400",[],Positive,Article,"['AAPL', 'AMZN', 'NVDA', 'GOOG', 'GOOGL', 'JNJ', 'JPM', 'MSFT', 'PYPL', 'T', 'VZ']"
https://seekingalpha.com/article/4685523-jpmorgan-solid-dividend-growth-stock-with-more-upside-potential-jpm-stock,https://cdn.snapi.dev/images/v1/0/g/j/bank45-2387209.jpg,JPMorgan: Solid Dividend Growth Stock With More Upside Potential,JPMorgan has outpaced the S&P 500 in total return due to its strong price growth from growing revenues across segments.,Seeking Alpha,"Tue, 23 Apr 2024 23:55:29 -0400","['dividend', 'paylimitwall']",Positive,Article,['JPM']
https://www.marketwatch.com/story/regulators-probe-potential-use-by-big-banks-of-nondisclosure-agreements-to-discourage-whistleblowers-report-00df01b8,https://cdn.snapi.dev/images/v1/3/a/n/bank18-2386525.jpg,Regulators probe potential use by big banks of nondisclosure agreements to discourage whistleblowers: report,"Some of the largest U.S. banks are being asked by the Commodities Futures Trading Commission to provide details about nondisclosure agreements for employees in an effort to protect potential whistleblowers, according to a report by Bloomberg.",Market Watch,"Tue, 23 Apr 2024 15:25:00 -0400",['paylimitwall'],Negative,Article,"['BAC', 'C', 'JPM']"
https://www.businesswire.com/news/home/20240423348674/en/JPMorgan-Chase-Opens-the-Doors-of-Its-New-Glasgow-Office/,https://cdn.snapi.dev/images/v1/j/8/press14-2385185.jpg,JPMorgan Chase Opens the Doors of Its New Glasgow Office,"GLASGOW, Scotland--(BUSINESS WIRE)--JPMorgan Chase will today welcome employees and guests to a ribbon-cutting ceremony at its new state-of-the-art technology home in Glasgow. The building is located on Argyle Street in the heart of Glasgow's International Finance District, and will bring employees together in one modern building after the firm had outgrown its previous premises. The 270,000 square foot building is designed to adapt to the future of work and provide a world-class experience for.",Business Wire,"Tue, 23 Apr 2024 08:00:00 -0400",['PressRelease'],Neutral,Article,['JPM']
https://www.reuters.com/business/finance/jpmorgan-china-names-new-heads-china-investment-banking-arm-2024-04-23/,https://cdn.snapi.dev/images/v1/a/l/f/bank6-2385034.jpg,JPMorgan China names new heads of China securities unit,"JPMorgan Chase & Co appoints Lu Fang to chair the board of its China securities arm, replacing former chair Park Pu, according to a company memo reviewed by Reuters and confirmed by a company spokesperson.",Reuters,"Tue, 23 Apr 2024 04:58:07 -0400",[],Positive,Article,['JPM']
https://finbold.com/jpmorgan-us-stocks-correction-far-from-over/?utm_source=snapi,https://cdn.snapi.dev/images/v1/p/o/9/bank39-2384700.jpg,JPMorgan: US stocks ‘correction' far from over,"Weeks after warning investors that stocks could crack at any moment, after which the United States equities, indeed, started to sell off, analysts at JPMorgan Chase (NYSE: JPM) continue to stand by their bearish prognoses, arguing that the correction in the American stock market is far from over.",Finbold,"Tue, 23 Apr 2024 04:38:32 -0400",[],Negative,Article,['JPM']
https://seekingalpha.com/article/4685212-jpmorgan-leads-all-banks-in-ai-world,https://cdn.snapi.dev/images/v1/o/c/7/bank38-2384694.jpg,JPMorgan Leads All Banks In AI World,JPMorgan Chase ranked first in commercial bank AI adoption and performance in financial services for the second time.,Seeking Alpha,"Tue, 23 Apr 2024 04:25:13 -0400",['paylimitwall'],Positive,Article,['JPM']
https://seekingalpha.com/article/4685140-forget-big-tech-earnings-buy-income-instead,https://cdn.snapi.dev/images/v1/8/g/m/computer-electronic2-2384231.jpg,"Forget Big Tech Earnings, Buy Income Instead","Big tech earnings are approaching, but I'm not betting on them. Big tech stocks have gotten too expensive. I have sold most of my U.S. tech stocks and reinvested the proceeds into high-income investments.",Seeking Alpha,"Mon, 22 Apr 2024 14:57:48 -0400","['earnings', 'paylimitwall']",Negative,Article,"['AAPL', 'AMZN', 'BAC', 'BMO', 'FHN', 'GOOG', 'GS', 'JPM', 'META', 'MS', 'OCSL', 'QQQ', 'RY', 'SCHW', 'TD', 'TSM']"
https://www.marketwatch.com/story/big-banks-have-been-a-bright-spot-in-tough-week-for-markets-bbff26ad,https://cdn.snapi.dev/images/v1/n/d/m/bank11-2381261.jpg,Big banks have been a bright spot in tough week for markets,"New bond deals totaling about $28.5 billion were issued by four of the nation's six largest banks: JP Morgan Chase & Co. JPM, +1.82%, Wells Fargo & Co. WFC, +2.77%, Goldman Sachs Group Inc. GS, +0.45% and Morgan Stanley MS, +0.91%, according to Kenneth Jacques, head of U.S. credit at Informa Global Markets.",Market Watch,"Fri, 19 Apr 2024 14:02:00 -0400",['paylimitwall'],Positive,Article,"['GS', 'JPM', 'MS', 'WFC']"
https://finbold.com/jim-cramer-warns-against-buying-the-dip-with-more-downside-ahead/?utm_source=snapi,https://cdn.snapi.dev/images/v1/l/z/f/bank21-2380206.jpg,Jim Cramer warns against buying the dip with more downside ahead,"After starting 2024 running, the stock market has entered into a significant downturn with the beginning of April, causing a surge in concerns about whether the U.S. is in fact, heading into a recession.",Finbold,"Fri, 19 Apr 2024 06:34:57 -0400",['cramer'],Negative,Article,['JPM']
https://www.reuters.com/business/finance/jpmorgan-dealmakers-lipsky-lee-are-leaving-bank-sources-say-2024-04-18/,https://cdn.snapi.dev/images/v1/u/k/3/bank4-2379494.jpg,"Exclusive: JPMorgan dealmakers Lipsky and Lee are leaving the bank, sources say","Two senior JPMorgan Chase dealmakers, Andy Lipsky and Haidee Lee, are leaving the bank, two sources familiar with the matter said on Thursday.",Reuters,"Thu, 18 Apr 2024 16:09:19 -0400",[],Negative,Article,['JPM']
https://investorplace.com/2024/04/the-3-best-bank-stocks-to-buy-on-q1-earnings-results/,https://cdn.snapi.dev/images/v1/q/c/m/bank6-2379199.jpg,The 3 Best Bank Stocks to Buy on Q1 Earnings Results,"First quarter earnings from the big banks are out, and the results, while mixed, were overall positive. The consensus view coming out of the Q1 prints is that the big U.S. banks are in good shape after two difficult years.",InvestorPlace,"Thu, 18 Apr 2024 14:14:46 -0400","['earnings', 'StocksToWatch']",Positive,Article,"['GS', 'JPM', 'WFC']"
https://www.reuters.com/legal/jpmorgan-chase-sues-russias-vtb-bank-over-effort-unfreeze-assets-2024-04-18/,https://cdn.snapi.dev/images/v1/v/b/x/bank31-2378946.jpg,JPMorgan Chase sues Russia's VTB Bank over effort to unfreeze assets,JPMorgan Chase sued Russia's state-owned VTB Bank on Thursday to halt its efforts to recover $439.5 million from an account that was blocked after Russia invaded Ukraine and VTB was hit with sanctions.,Reuters,"Thu, 18 Apr 2024 11:50:29 -0400",[],Negative,Article,['JPM']
https://www.fool.com/investing/2024/04/18/if-i-could-only-buy-3-stocks-in-2024-id-pick-these/,https://cdn.snapi.dev/images/v1/7/b/e/entertainment-diversified4-2377834.jpg,"If I Could Buy Only 3 Stocks in 2024, I'd Pick These","It may never be a growth powerhouse, but Coca-Cola is most definitely a cash-generating juggernaut. Despite disappointing guidance recently, JPMorgan Chase is improving on a number of fronts.",The Motley Fool,"Thu, 18 Apr 2024 07:35:00 -0400",[],Positive,Article,"['DIS', 'JPM', 'KO']"
https://www.businesswire.com/news/home/20240418924942/en/Impact-Disclosure-Taskforce-Releases-Impact-Disclosure-Guidance-Helping-Scale-Financing-for-the-UN-Sustainable-Development-Goals/,https://cdn.snapi.dev/images/v1/1/z/press14-2377498.jpg,"Impact Disclosure Taskforce Releases Impact Disclosure Guidance, Helping Scale Financing for the UN Sustainable Development Goals","NEW YORK--(BUSINESS WIRE)--The Impact Disclosure Taskforce today released its draft impact disclosure guidance, helping entities committed to addressing development needs and reducing global inequality to access growing pools of sustainable capital. Established in April of 2023 and now a 60+ strong network of financial institutions, capital markets participants, and industry stakeholders, the Taskforce was formed to help corporate entities and sovereigns measure and disclose their efforts to re.",Business Wire,"Thu, 18 Apr 2024 04:00:00 -0400",['PressRelease'],Neutral,Article,['JPM']
https://www.youtube.com/watch?v=CGJyfV3h1Pg,https://cdn.snapi.dev/images/v1/c/m/v/bank22-2377358.jpg,"JPMorgan's stock ran too much into the quarter, says Jim Cramer",'Mad Money' host Jim Cramer breaks down bank earnings.,CNBC Television,"Wed, 17 Apr 2024 19:44:42 -0400","['cramer', 'madmoney', 'earnings']",Negative,Video,['JPM']
https://investorplace.com/2024/04/invest-like-a-hawk-7-stocks-to-own-if-the-fed-stays-tough/,https://cdn.snapi.dev/images/v1/n/r/x/reit18-2376558.jpg,Invest Like a Hawk: 7 Stocks to Own If the Fed Stays Tough,"While earlier discussions focused on the Federal Reserve's potential interest rate cuts, that's no longer a surefire proposition, thus warranting consideration for stocks for Fed hikes. Let's break this matter down.",InvestorPlace,"Wed, 17 Apr 2024 12:55:22 -0400",[],Positive,Article,"['AMT', 'HD', 'JPM', 'KMI', 'KVUE', 'O', 'BRK-A', 'BRK-B']"
https://www.zacks.com/stock/news/2256553/bank-etfs-in-focus-on-mixed-q1-earnings?cid=CS-STOCKNEWSAPI-FT-etf_news_and_commentary-2256553,https://cdn.snapi.dev/images/v1/c/3/4/bank14-2375785.jpg,Bank ETFs in Focus on Mixed Q1 Earnings,"While most big banks beat on both lines in the first-quarter earnings season, higher rates may weigh on the financial ETFs over the medium term.",Zacks Investment Research,"Wed, 17 Apr 2024 09:00:21 -0400",['earnings'],Negative,Article,"['BAC', 'C', 'GS', 'IAI', 'IYG', 'JPM', 'KBWB', 'MS', 'VFH', 'WFC', 'XLF']"
https://www.investors.com/research/options/jpmorgan-jpm-stock-option-trading/,https://cdn.snapi.dev/images/v1/g/q/d/bank22-2375929.jpg,JPMorgan May Have Found Its Footing; How To Trade It With Options,This broken wing butterfly trade on JPM stock has a profit zone between 170 and 180.,Investors Business Daily,"Wed, 17 Apr 2024 08:24:52 -0400",['paywall'],Positive,Article,['JPM']
https://www.fool.com/investing/2024/04/17/these-2-financial-stocks-just-raised-their-dividen/,https://cdn.snapi.dev/images/v1/m/a/n/bank43-2375200.jpg,These 2 Financial Stocks Just Raised Their Dividends,"A leading U.S. bank is capitalizing nicely on the health of the economy. Meanwhile, a top payment-card company just declared a hefty dividend raise of 17%.",The Motley Fool,"Wed, 17 Apr 2024 05:30:00 -0400",['dividend'],Positive,Article,"['AXP', 'JPM']"
https://www.youtube.com/watch?v=UjnHihbaHLM,https://cdn.snapi.dev/images/v1/s/y/l/bank31-2374789.jpg,"Bank deposits are 'the bogeyman' that could be a long-term problem, analyst says","Bank of America (BAC) and Morgan Stanley (MS) were the latest Big Bank stocks to report first-quarter earnings on Tuesday. Both topped earnings and revenue estimates, a trend consistent for major financial players who have reported earnings so far.",Yahoo Finance,"Tue, 16 Apr 2024 17:55:51 -0400",[],Negative,Video,"['BAC', 'C', 'GS', 'JPM', 'MS', 'WFC']"
https://www.wsj.com/articles/bank-of-america-morgan-stanley-earnings-q1-2024-4fe97e75,https://cdn.snapi.dev/images/v1/d/s/x/bank39-2374010.jpg,Three Key Takeaways From Big Bank Earnings,"Top U.S. banks, including Bank of America, JPMorgan and Goldman, posted better-than-expected quarterly results thanks to a resilient economy, strong consumer spending and a flurry of Wall Street activity.",WSJ,"Tue, 16 Apr 2024 10:53:00 -0400","['earnings', 'paywall']",Positive,Article,"['BAC', 'C', 'GS', 'JPM', 'MS', 'WFC']"
https://www.investors.com/etfs-and-funds/sectors/sp500-wealth-creator-stocks-make-investors-filthy-rich/,https://cdn.snapi.dev/images/v1/6/r/7/computer-electronic12-2373365.jpg,15 'Wealth Creator' Stocks Make Investors Filthy Rich,Not sure which S&P 500 stocks are best to buy for the next 10 years? There's no question where the best place to put your money was.,Investors Business Daily,"Tue, 16 Apr 2024 08:00:19 -0400",[],Positive,Article,"['AAPL', 'AMZN', 'AVGO', 'BRK-A', 'BRK-B', 'GOOG', 'GOOGL', 'JPM', 'LLY', 'MA', 'META', 'MSFT', 'NVDA', 'TSLA', 'UNH', 'V']"
https://www.businessinsider.com/jpmorgan-jamie-dimon-stock-sales-billionaires-wall-street-banks-economy-2024-4,https://cdn.snapi.dev/images/v1/3/u/x/bank18-2373226.jpg,Jamie Dimon made $183 million from selling JPMorgan stock,"Jamie Dimon has raked in $183 million from his planned sale of 1 million JPMorgan shares. JPMorgan's CEO sold stock worth $33 million on Monday, after selling a $150 million tranche in February.",Business Insider,"Tue, 16 Apr 2024 07:57:19 -0400","['CEO', 'paywall']",Positive,Article,['JPM']
https://www.youtube.com/watch?v=pq2dIoAR_hY,https://cdn.snapi.dev/images/v1/h/s/x/bank38-2373285.jpg,"Higher deposit costs will weigh on the big banks, says Stephen Biggar","Stephen Biggar, Director of Financial Institutions Research at Argus Research, discusses earnings from Bank of America and Morgan Stanley.",CNBC Television,"Tue, 16 Apr 2024 06:51:29 -0400",[],Negative,Video,"['BAC', 'C', 'GS', 'JPM', 'MS', 'WFC']"
https://www.fool.com/investing/2024/04/16/why-jpmorgan-chase-down-earnings-things-know/,https://cdn.snapi.dev/images/v1/t/1/b/bank20-2372881.jpg,Why Is JPMorgan Chase Down Following Earnings? Here Are 4 Things Investors Need to Know.,"JPMorgan Chase kicked off earnings season, reporting first-quarter results that beat analysts' estimates. The bank's guidance on net interest income remained the same, disappointing investors who expected it to raise guidance.",The Motley Fool,"Tue, 16 Apr 2024 05:03:00 -0400",[],Negative,Article,['JPM']
https://nypost.com/2024/04/15/business/jamie-dimon-rakes-in-more-than-180m-from-planned-sale-of-jpmorgan-stock/,https://cdn.snapi.dev/images/v1/a/d/m/bank4-2372669.jpg,Jamie Dimon rakes in more than $180M from planned sale of JPMorgan stock,"Last October, JPMorgan had said Dimon and his family intended to sell 1 million of their 8.6 million shares, the first time Dimon was selling shares since becoming the CEO of the largest US lender in 2005.",New York Post,"Mon, 15 Apr 2024 19:14:39 -0400",['CEO'],Negative,Article,['JPM']
https://www.reuters.com/business/finance/jpmorgan-ceo-dimon-sells-about-33-mln-shares-completes-planned-sale-2024-04-15/,https://cdn.snapi.dev/images/v1/v/l/a/bank41-2372615.jpg,"JPMorgan CEO Dimon sells about $33 mln shares, completes planned sale","JPMorgan Chase CEO Jamie Dimon has sold about $33 million of his shares in the bank, a regulatory filing showed on Monday, completing a previously disclosed plan to sell 1 million shares.",Reuters,"Mon, 15 Apr 2024 18:15:00 -0400",['CEO'],Negative,Article,['JPM']
https://www.businesswire.com/news/home/20240415452478/en/JPMorgan-Chase-2024-Annual-Meeting-of-Shareholders/,https://cdn.snapi.dev/images/v1/p/r/press5-2372489.jpg,JPMorgan Chase 2024 Annual Meeting of Shareholders,"NEW YORK--(BUSINESS WIRE)--As previously announced, the JPMorgan Chase & Co. annual meeting of shareholders will be held on Tuesday, May 21, 2024 at 10:00 a.m. (Eastern). The meeting will be held virtually. Attending the annual meeting To participate in the virtual meeting, visit http://www.virtualshareholdermeeting.com/JPM2024 and enter the 16-digit control number included on your proxy card, voting instruction form or notice you previously received. Shareholders may submit questions eithe.",Business Wire,"Mon, 15 Apr 2024 16:34:00 -0400",['PressRelease'],Neutral,Article,['JPM']
https://www.fool.com/investing/2024/04/15/1-wall-street-analyst-thinks-jpmorgan-chase-stock/,https://cdn.snapi.dev/images/v1/9/k/w/bank21-2372244.jpg,1 Wall Street Analyst Thinks JPMorgan Chase Stock Is Going to $215. Is It a Buy Around $183?,"The pundit reiterated his rather bullish take on the bank's proximate future. This, despite a quarterly earnings report that generally displeased the market.",The Motley Fool,"Mon, 15 Apr 2024 13:55:20 -0400",[],Positive,Article,['JPM']
https://www.youtube.com/watch?v=1mDULjSp8ec,https://cdn.snapi.dev/images/v1/h/h/k/bank40-2371587.jpg,KBW CEO Michaud Sees Accelerated Bank Earnings in 2025,"KBW CEO Tom Michaud examines first-quarter bank earnings, including firms' balance sheet advantage over non-banks and the bull case for an acceleration in bank earnings.",Bloomberg Markets and Finance,"Mon, 15 Apr 2024 09:31:55 -0400","['CEO', 'earnings']",Positive,Video,"['BAC', 'C', 'GS', 'JPM', 'MS', 'WFC']"
https://www.businesswire.com/news/home/20240415339792/en/JPMorgan-Announces-Extension-of-Exchange-Offer-Relating-to-Its-Alerian-MLP-Index-ETNs/,https://cdn.snapi.dev/images/v1/y/m/press17-2371574.jpg,JPMorgan Announces Extension of Exchange Offer Relating to Its Alerian MLP Index ETNs,"NEW YORK--(BUSINESS WIRE)--JPMorgan Chase & Co. (“JPMorgan Chase” or the “Firm”) and JPMorgan Chase Financial Company LLC (“JPMorgan Financial”) announced today that they have extended the expiration date for JPMorgan Financial's previously announced offer to exchange (the “Exchange Offer”) its Alerian MLP Index ETNs due January 28, 2044 (CUSIP: 48133Q309) (the “New Notes” ) for any and all outstanding Alerian MLP Index ETNs due May 24, 2024 (CUSIP: 46625H365) issued by JPMorgan Chase (the.",Business Wire,"Mon, 15 Apr 2024 09:00:00 -0400",['PressRelease'],Neutral,Article,['JPM']
https://www.fool.com/investing/2024/04/15/is-jpmorgan-chase-stock-a-buy-on-this-dip/,https://cdn.snapi.dev/images/v1/h/q/a/bank30-2370791.jpg,Is JPMorgan Chase Stock a Buy On This Dip?,JPMorgan's loan portfolio is healthier than most of its peers. The big bank's balance sheet is also stronger than most other banks.,The Motley Fool,"Mon, 15 Apr 2024 03:45:00 -0400",[],Positive,Article,['JPM']
https://www.investopedia.com/what-we-learned-from-big-bank-earnings-on-friday-8630633,https://cdn.snapi.dev/images/v1/k/p/2/bank45-2370370.jpg,What We Learned From Big Bank Earnings on Friday,Large U.S. banks kicked off the first-quarter earnings report season by disclosing higher-than-expected profits. But their net interest income—a key performance indicator for the sector—fell shy of projections.,Investopedia,"Sat, 13 Apr 2024 15:45:40 -0400",['earnings'],Neutral,Article,"['C', 'JPM', 'WFC']"
